{
  "schema_version": "station-of.registration.v1",
  "record_revision": "example-v1",
  "station": {
    "id": "station-red-1",
    "identity": "future-principal",
    "owner_repository": "STATION-OF/station-of",
    "owner_branch": "main"
  },
  "registration": {
    "state": "unverified",
    "mode": "station-controlled",
    "verified_at": null
  },
  "endpoint": null,
  "reply_to": {
    "capability": "none",
    "host_id": null,
    "thread_id": null
  },
  "provenance": {
    "source": "illustrative only; not an endpoint claim",
    "observed_at": "2026-07-24T09:36:30Z"
  }
}
